record_id,pmid,doi,title
33418459,33418459,10.1016/j.psychres.2020.113694,Associations between the type and number of chronic diseases and suicidal thoughts among Korean adults.
33401279,33401279,10.1159/000512456,A Short Cycle of Narrow-Band UVB Phototherapy in the Early Phase of Dupilumab Therapy Can Provide a Quicker Improvement of Severe Atopic Dermatitis.
33372068,33372068,10.1136/bmjopen-2020-038324,Risk factors for mental illness in adults with atopic eczema or psoriasis: protocol for a systematic review.
33334332,33334332,10.1186/s12895-020-00117-8,Associations of self-reported atopic dermatitis with comorbid conditions in adults: a population-based cross-sectional study.
33332864,33332864,10.1097/DER.0000000000000687,"High Levels of Psychological Distress, Sleep Disturbance, and Alcohol Use Disorder in Adults With Atopic Dermatitis."
33289992,33289992,10.1097/DER.0000000000000548,Maternal Depression and Atopic Dermatitis in American Children and Adolescents.
33273234,33273234,10.1097/DER.0000000000000680,Mental Health Symptoms and Functional Impairment in Children With Atopic Dermatitis.
33273219,33273219,10.1097/DER.0000000000000653,Measurement Properties of Patient Health Questionnaire 9 and Patient Health Questionnaire 2 in Adult Patients With Atopic Dermatitis.
33246439,33246439,10.1186/s12889-020-09940-7,"Health behaviors in major chronic diseases patients: trends and regional variations analysis, 2008-2017, Korea."
33195970,33195970,10.5414/ALX02174E,Atopic dermatitis and psychosocial comorbidities - What's new?
33180320,33180320,10.1007/s13555-020-00459-8,The Economic and Psychosocial Comorbidity Burden Among Adults with Moderate-to-Severe Atopic Dermatitis in Europe: Analysis of a Cross-Sectional Survey.
33175413,33175413,10.1111/ced.14507,Comorbidities of alopecia areata: a population-based cohort study.
33126372,33126372,10.1097/MD.0000000000022983,"Evaluation of life quality, anxiety, and depression in patients with skin diseases."
33096640,33096640,10.3390/biomedicines8100439,Anti-Inflammatory Effects of M-MSCs in DNCB-Induced Atopic Dermatitis Mice.
33090454,33090454,10.1111/bjd.19597,Atopic eczema and obesity: a population-based study.
33053244,33053244,10.1111/cea.13759,"Multimorbidity in asthma, association with allergy, inflammatory markers and symptom burden, results from the Swedish GA2 LEN study."
33047404,33047404,10.1111/pai.13394,Healthcare utilization in Danish children with atopic dermatitis and parental topical corticosteroid phobia.
33034929,33034929,10.1111/dth.14389,Psychiatric comorbidity and temperament-character traits of the patients with lichen simplex chronicus: The relation with the symptom severity of the disease.
33026770,33026770,10.36849/JDD.2020.5422,Impact of Atopic Dermatitis Lesion Location on Quality of Life in Adult Patients in a Real-world Study.
32993599,32993599,10.1186/s12895-020-00107-w,Dermatologists' perceptions of suicidality in dermatological practice: a survey of prevalence estimates and attitudes in Austria.
32975811,32975811,10.1111/jdv.16950,Social and psychosocial effects on atopic eczema symptom severity - a scoping review of observational studies published from 1989 to 2019.
32962676,32962676,10.1186/s12895-020-00103-0,Weight gain in patients with severe atopic dermatitis treated with dupilumab: a cohort study.
32962454,32962454,10.1080/09546634.2020.1826395,Self-perceived disease control in childhood eczema.
32933511,32933511,10.1186/s12913-020-05706-4,Effectiveness and cost-effectiveness of treatment with additional enrollment to a homeopathic integrated care contract in Germany.
32880195,32880195,10.1177/1203475420952424,"Estimated Frequency of Psychodermatologic Conditions in Alberta, Canada."
32803784,32803784,10.1111/ced.14422,Psychosocial burden and out-of-pocket costs in patients with atopic dermatitis in Ireland.
32798581,32798581,10.1016/j.jaad.2020.08.035,"The characteristics and impact of pruritus in adult dermatology patients: A prospective, cross-sectional study."
32791209,32791209,10.1016/j.bbi.2020.08.003,Depressive and anxiety symptomatology among people with asthma or atopic dermatitis: A population-based investigation using the UK Biobank data.
32754401,32754401,10.7759/cureus.8861,Dermatology Resident Training on Depression Screening: A Cross-Sectional Survey.
32691892,32691892,10.1111/all.14510,Efficacy and safety of dupilumab for moderate-to-severe atopic dermatitis: A systematic review for the EAACI biologicals guidelines.
32687299,32687299,10.17116/kurort20209704137,[To the question of the possibility of using selective chromotherapy for allergic diseases in children].
32564929,32564929,10.1016/j.anai.2020.04.010,Association of atopic dermatitis and suicide: more than a coincidence?
32531131,32531131,10.1111/jdv.16727,Comorbidities in pediatric alopecia areata.
32513467,32513467,10.1016/j.apnu.2020.01.002,Factors affecting depression in high school students with chronic illness: A nationwide cross-sectional study in South Korea.
32508997,32508997,10.3892/etm.2019.8145,Assessment of suicidal behavior in dermatology (Review).
32492087,32492087,10.1001/jamadermatol.2020.1406,Efficacy and Safety of Abrocitinib in Patients With Moderate-to-Severe Atopic Dermatitis: A Randomized Clinical Trial.
32452056,32452056,10.1111/1346-8138.15386,Health-related behaviors and mental health states of South Korean adolescents with atopic dermatitis.
32449783,32449783,10.2340/00015555-3531,Psychological Consequences of the Most Common Dermatoses: Data from the Objectifs Peau Study.
32447863,32447863,10.29262/ram.v67i1.700,[The annual cost of medical care for patients with moderate to severe atopic dermatitis in Mexico. A multicenter study].
32438781,32438781,10.23736/S2784-8671.20.06654-7,"Diagnosis and management of moderate to severe atopic dermatitis in adolescents. A Consensus by the Italian Society of Dermatology and Venereology (SIDeMaST), the Italian Association of Hospital Dermatologists and Public Health (ADOI), the Italian Association of Hospital and Territorial Allergists and Immunologists (AAIITO), the Italian Society of Allergy, Asthma and Clinical Immunology (SIAAIC), the Italian Society of Pediatric Allergy and Immunology (SIAIP), the Italian Society of Allergological, Occupational and Environmental Dermatology (SIDAPA), and the Italian Society of Pediatric Dermatology (SIDerP)."
32416664,32416664,10.12932/AP-221119-0699,Prenatal maternal anxiety promotes atopic dermatitis in offspring via placental DNA methylation changes.
32401719,32401719,10.1016/j.ad.2020.04.009,Comorbidities in Atopic Dermatitis: An Update and Review of Controversies.
32390578,32390578,10.1017/neu.2020.23,Interleukin-4 and anxiety in adults with atopic dermatitis.
32382467,32382467,10.7759/cureus.7565,Dupilumab for Atopic Dermatitis: The Silver Bullet We Have Been Searching for?
32323397,32323397,10.1111/dth.13452,Steroid phobia in children with atopic dermatitis and their caregivers in Singapore.
32316146,32316146,10.3390/ijerph17082743,Depressive Symptoms and Sleep Disturbance in Female Nurses with Atopic Dermatitis: The Korea Nurses' Health Study.
32270322,32270322,10.1007/s00403-020-02074-1,The utility of PROMIS domain measures in dermatologic care.
32248177,32248177,NA,Emotional distress and quality of life in allergic diseases.
32240758,32240758,10.1016/j.anai.2020.03.023,"Association of atopic dermatitis with suicide risk among 788,411 adolescents: A Korean cross-sectional study."
32234288,32234288,10.1016/j.alit.2020.02.009,Dupilumab therapy rapidly improved alopecia areata associated with trichotillomania in an atopic dermatitis patient.
32199977,32199977,10.1016/j.anai.2020.03.006,Comparison of Patient-Oriented Eczema Measure and Patient-Oriented Scoring Atopic Dermatitis vs Eczema Area and Severity Index and other measures of atopic dermatitis: A validation study.
32191772,32191772,10.1371/journal.pone.0230585,Development and psychometrics of the English version of the Itch Cognitions Questionnaire.
32183179,32183179,10.3390/jcm9030791,Clinical Response and Quality of Life in Patients with Severe Atopic Dermatitis Treated with Dupilumab: A Single-Center Real-Life Experience.
32173859,32173859,10.1111/ajd.13268,"Prevalence, incidence and management of atopic dermatitis in Australian general practice using routinely collected data from MedicineInsight."
32173490,32173490,10.1016/j.chest.2020.01.052,Maternal Distress During Pregnancy and Recurrence in Early Childhood Predicts Atopic Dermatitis and Asthma in Childhood.
32171815,32171815,10.1016/j.jaad.2020.02.079,Efficacy of targeted education in reducing topical steroid phobia: A randomized clinical trial.
32168146,32168146,10.1097/DER.0000000000000550,Association of Adverse Childhood Experiences With Childhood Atopic Dermatitis in the United States.
32155280,32155280,10.3928/19382359-20200217-01,Atopic Dermatitis: Update on Pathogenesis and Therapy.
32141620,32141620,10.1111/all.14258,Understanding the challenges faced by adolescents and young adults with allergic conditions: A systematic review.
32093459,32093459,10.30773/pi.2019.0193,Skin Diseases in Patients with Primary Psychiatric Disorders.
32091463,32091463,10.1097/DER.0000000000000582,"Insights From Caregivers on the Impact of Pediatric Atopic Dermatitis on Families: ""I'm Tired, Overwhelmed, and Feel Like I'm Failing as a Mother""."
32026645,32026645,10.1111/ddg.14029,Atopic dermatitis and psychosocial comorbidities.
32021661,32021661,10.1016/j.waojou.2019.100097,Risk of comorbidities in patients diagnosed with chronic urticaria: A nationwide registry-study.
32006346,32006346,10.1007/s13555-020-00356-0,Qualitative Assessment of Adult Patients' Perception of Atopic Dermatitis Using Natural Language Processing Analysis in a Cross-Sectional Study.
31997735,31997735,10.1016/S0151-9638(20)30016-8,[Not Available].
31981369,31981369,10.1002/14651858.CD013128.pub2,Interventions for chronic pruritus of unknown origin.
31950338,31950338,10.1007/s13555-020-00351-5,The Validity of Cutaneous Body Image as a Construct and as a Mediator of the Relationship Between Cutaneous Disease and Mental Health.
31918393,31918393,10.1016/j.phymed.2019.153137,I. inflexus (Thunb.) Kudo extract improves atopic dermatitis and depressive-like behavior in DfE-induced atopic dermatitis-like disease.
31916233,31916233,10.1007/5584_2019_470,Depression and Serum Content of Serotonin in Adult Patients with Atopic Dermatitis.
31914445,31914445,10.1159/000504388,Biological Sex and IgE Sensitization Influence Severity of Depression and Cortisol Levels in Atopic Dermatitis.
31914034,31914034,10.1097/MD.0000000000018565,Efficacy and safety of So-Cheong-Ryong-Tang in patients with atopic dermatitis and respiratory disorders: Study protocol of a double-blind randomized placebo-controlled trial.
31889448,31889448,10.1080/13548506.2019.1710545,"Determination of depression, anxiety and stress (DAS) levels in patients with atopic dermatitis: a case-control study."
31838780,31838780,10.1111/jdv.16149,Effectiveness of a music intervention on pruritus: an open randomized prospective study.
31838777,31838777,10.1111/jdv.16148,"Depression, anxiety and quality of life in subjects with atopic eczema in a population-based cross-sectional study in Germany."
31819466,31819466,10.2147/TCRM.S226456,Severe Atopic Dermatitis In Spain: A Real-Life Observational Study.
31721316,31721316,10.1111/jdv.16078,"Baseline characteristics, disease severity and treatment history of patients with atopic dermatitis included in the German AD Registry TREATgermany."
31692377,31692377,10.1177/1203475419882655,Approach to the Assessment and Management of Pediatric Patients with Atopic Dermatitis: A Consensus Document. Section II: Comorbid Disease in Pediatric Atopic Dermatitis.
31673678,31673678,10.1136/gpsych-2019-100094,Concomitant atopic dermatitis and narcolepsy type 1: psychiatric implications and challenges in management.
31660839,31660839,10.2174/1573396315666191029123822,Biologics in Children with Allergic Diseases.
31648383,31648383,10.1111/bjd.18629,Underscreening of depression in U.S. outpatients with atopic dermatitis and psoriasis.
31626880,31626880,10.1016/j.jaad.2019.10.019,Mental health impairment among children with atopic dermatitis: A United States population-based cross-sectional study of the 2013-2017 National Health Interview Survey.
31587373,31587373,10.1111/jdv.16003,The patient-reported disease burden in adults with atopic dermatitis: a cross-sectional study in Europe and Canada.
31571203,31571203,10.1111/bjd.18455,Overcoming poor adherence is a major hurdle to managing atopic dermatitis.
31479767,31479767,10.1016/j.jaip.2019.08.030,Atopic Eczema in Adulthood and Risk of Depression and Anxiety: A Population-Based Cohort Study.
31447731,31447731,10.3389/fpsyg.2019.01773,Risk of Mental Disorders in Children and Adolescents With Atopic Dermatitis: A Systematic Review and Meta-Analysis.
31442084,31442084,10.1080/09546634.2019.1659479,Dupilumab and prurigo nodularis-like phenotype in atopic dermatitis: our experience of efficacy.
31437300,31437300,10.1111/bjd.18451,"Higher self-reported severity of atopic dermatitis in adults is associated with poorer self-reported health-related quality of life in France, Germany, the U.K. and the U.S.A."
31343729,31343729,10.1111/bjd.18252,Depression and anxiety in atopic dermatitis: increasing recognition and opportunities to intervene.
31317599,31317599,10.1111/cea.13416,Effects of shared medical appointments compared to individual appointments in children with atopic dermatitis: A pragmatic randomized controlled trial.
31305182,31305182,10.1080/09546634.2019.1639604,Treatment patterns in UK adult patients with atopic dermatitis treated with systemic immunosuppressants: data from The Health Improvement Network (THIN).
31291386,31291386,10.31744/einstein_journal/2019RC4599,Dupilumab in the treatment of severe atopic dermatitis refractory to systemic immunosuppression: case report.
31289842,31289842,10.2340/00015555-3257,Burden of Atopic Dermatitis in Swedish Adults: A Population-based Study.
31257575,31257575,10.1111/bjd.18265,Quantitative analysis of topical treatments in atopic dermatitis: unexpectedly low use of emollients and strong correlation of topical corticosteroid use both with depression and concurrent asthma.
31239682,31239682,10.2147/NDT.S191509,"Cross-sectional study of psychiatric comorbidities in patients with atopic dermatitis and nonatopic eczema, urticaria, and psoriasis."
31201863,31201863,10.1016/j.anai.2019.06.002,Depression and psychological distress in US adults with atopic dermatitis.
31180795,31180795,10.1080/09546634.2019.1630702,Defining the role of mirtazapine in the treatment of refractory pruritus.
31179791,31179791,10.1080/09546634.2019.1612836,"Dupilumab improves patient-reported symptoms of atopic dermatitis, symptoms of anxiety and depression, and health-related quality of life in moderate-to-severe atopic dermatitis: analysis of pooled data from the randomized trials SOLO 1 and SOLO 2."
31144163,31144163,10.1007/s00431-019-03380-1,Influence of chronic diseases on the olfactory function in children.
31109652,31109652,10.1016/j.jdermsci.2019.02.002,Efficacy and safety of dupilumab monotherapy in adults with moderate-to-severe atopic dermatitis: a pooled analysis of two phase 3 randomized trials (LIBERTY AD SOLO 1 and LIBERTY AD SOLO 2).
31099401,31099401,10.2340/00015555-3220,Topical Corticosteroid Phobia Among Healthcare Professionals Using the TOPICOP Score.
31045830,31045830,10.1097/MD.0000000000015479,"Efficacy and safety of Soshiho-tang in patients with atopic dermatitis and gastrointestinal disorders: Study protocol for a double-blind, randomized, and placebo-controlled clinical trial."
31034875,31034875,10.1016/j.anai.2019.04.020,Comorbidities and the impact of atopic dermatitis.
31017024,31017024,10.1080/02770903.2019.1604743,Asthma phenotypes and associated comorbidities in a large cohort of adolescents in Israel.
31011985,31011985,10.1007/s12026-019-09076-w,Patients with atopy exhibit reduced cortisol awakening response but not cortisol concentrations during the rest of the day.
31002197,31002197,10.1111/jdv.15634,Atopic eczema: burden of disease and individual suffering - results from a large EU study in adults.
30981057,30981057,10.1016/j.jad.2019.04.037,Allergic rhinitis increases the risk of incident panic disorder among young individuals: A nationwide population-based cohort study in Taiwan.
30980616,30980616,10.1111/jocd.12940,Serum levels of brain-derived neurotrophic factor in patients with acne vulgaris.
30972740,30972740,10.1111/bjd.18002,Validation of five patient-reported outcomes for atopic dermatitis severity in adults.
30942837,30942837,10.1001/jamadermatol.2019.0124,Problematic Strength of the Association Between Atopic Dermatitis and Suicidality-Reply.
30942821,30942821,10.1001/jamadermatol.2019.0195,Problematic Strength of the Association Between Atopic Dermatitis and Suicidality.
30923900,30923900,10.1007/s00403-019-01911-2,Pre-natal folic acid and iron supplementation and atopic dermatitis in the first 6 years of life.
30914145,30914145,10.1016/j.aprim.2018.04.011,[Family functioning and depression in mothers and children with atopic dermatitis].
30909326,30909326,NA,Low Dose Naltrexone in Dermatology.
30905805,30905805,10.1016/j.jaad.2019.03.037,"Burden of illness in adults with atopic dermatitis: Analysis of National Health and Wellness Survey data from France, Germany, Italy, Spain, and the United Kingdom."
30882946,30882946,10.1111/pde.13784,Topical corticosteroid phobia among caretakers of children with atopic dermatitis: A cross-sectional study using TOPICOP in Japan.
30838645,30838645,10.1111/bjd.17683,Symptoms and diagnosis of anxiety and depression in atopic dermatitis in U.S. adults.
30782347,30782347,10.1016/j.jpsychores.2019.01.001,Factors affecting self-reported chemical intolerance: A five-year follow-up study in Japan.
30774033,30774033,10.13109/zptm.2019.65.1.14,"[Are there indications of ""sensory processing sensitivity"" (SPS) in atopically predisposed persons? - An examination of parents of children with atopic dermatitis in inpatient treatment]."
30773959,30773959,10.1080/08923973.2018.1558235,Tachykinin upregulation in atopic dermatitis.
30729499,30729499,10.1111/bjd.17744,Peak Pruritus Numerical Rating Scale: psychometric validation and responder definition for assessing itch in moderate-to-severe atopic dermatitis.
30702001,30702001,10.1080/02770903.2019.1571086,A cross sectional survey on health-related quality of life among parents of children with allergic symptoms using the EQ-5D-5L.
30678097,30678097,10.3390/ijerph16030305,Health-Related Quality of Life Impairment among Patients with Different Skin Diseases in Vietnam: A Cross-Sectional Study.
30677844,30677844,NA,PatientsLikeMe and atopic dermatitis: characterizing the atopic dermatitis patient profile.
30650301,30650301,10.4178/epih.e2018059,"Estimating causal associations of atopic dermatitis with depression using the propensity score method: an analysis of Korea Community Health Survey data, 2010-2013."
30589434,30589434,10.1111/all.13708,Inverted U-shaped relationship between vitamin D and ever-reported eczema in US adults.
30571970,30571970,10.1016/j.jid.2018.11.029,Measurement Properties of the Hospital Anxiety and Depression Scale Used in Atopic Dermatitis in Adults.
30540348,30540348,10.1001/jamadermatol.2018.4566,Association Between Atopic Dermatitis and Suicidality: A Systematic Review and Meta-analysis.
30532792,30532792,10.7573/dic.212547,Dismissing the fallacies of childhood eczema management: case scenarios and an overview of best practices.
30527454,30527454,10.1016/j.ad.2018.10.007,Consensus Statement on the Psychological Needs of Patients With Chronic Inflammatory Skin Diseases.
30470324,30470324,10.1016/j.jpsychores.2018.10.015,Asthma and other allergic diseases in relation to suicidal behavior among South Korean adolescents.
30468531,30468531,10.1111/jdv.15360,Diagnosis validation and clinical characterization of atopic dermatitis in Nurses' Health Study 2.
30466789,30466789,10.1016/j.jpeds.2018.10.037,Korean Youth with Comorbid Allergic Disease and Obesity Show Heightened Psychological Distress.
30439296,30439296,10.1177/1203475418805709,Approach to the Assessment and Management of Adult Patients With Atopic Dermatitis: A Consensus Document. Section III: Evaluation of Atopic Dermatitis Patients for Comorbidities.
30430485,30430485,NA,Atopic dermatitis and mother-child interaction: a comparative study of 48 dyads.
30426693,30426693,10.1111/aos.13961,"A nationwide population-based study of social demographic factors, associated diseases and mortality of keratoconus patients in Denmark from 1977 to 2015."
30390206,30390206,10.1007/s40257-018-0405-2,The Medical and Psychosocial Associations of Alopecia: Recognizing Hair Loss as More Than a Cosmetic Concern.
30389491,30389491,10.1016/j.jid.2018.08.028,Atopic Dermatitis in America Study: A Cross-Sectional Study Examining the Prevalence and Disease Burden of Atopic Dermatitis in the US Adult Population.
30383905,30383905,10.1111/jdv.15321,Exploring the association between parental psychiatric disease and childhood atopic dermatitis: a matched case-control study.
30365995,30365995,10.1016/j.jaad.2018.08.063,"Association between atopic dermatitis, depression, and suicidal ideation: A systematic review and meta-analysis."
30338542,30338542,10.1111/pde.13698,Corticosteroid phobia (corticophobia) in parents of young children with atopic dermatitis and their health care providers.
30277424,30277424,10.1080/09546634.2018.1530442,Caregiver willingness to treat atopic dermatitis is not much improved by anchoring.
30234614,30234614,10.1097/DER.0000000000000401,Sleep Disturbance and Sleep-Related Impairment in Adults With Atopic Dermatitis: A Cross-sectional Study.
30215910,30215910,NA,Breastfeeding: Common Questions and Answers.
30198582,30198582,10.1111/jdv.15244,Predictors of treatment success in children with difficult to treat atopic dermatitis using a personalized integrative multidisciplinary (PIM) treatment programme.
30192705,30192705,10.1080/16506073.2018.1504320,Exposure-based cognitive behavior therapy for atopic dermatitis: an open trial.
30168085,30168085,10.1007/s40257-018-0383-4,Major Comorbidities of Atopic Dermatitis: Beyond Allergic Disorders.
30119868,30119868,10.1016/j.jaad.2018.03.017,"Association of atopic dermatitis with depression, anxiety, and suicidal ideation in children and adults: A systematic review and meta-analysis."
30092267,30092267,10.1016/j.anai.2018.07.040,"Content and construct validity, predictors, and distribution of self-reported atopic dermatitis severity in US adults."
30092266,30092266,10.1016/j.anai.2018.07.042,"Association of atopic dermatitis with allergic, autoimmune, and cardiovascular comorbidities in US adults."
30075341,30075341,10.1016/j.jaip.2018.05.038,Phenotypic Characterization of Eosinophilic Esophagitis in a Large Multicenter Patient Population from the Consortium for Food Allergy Research.
30027349,30027349,10.1007/s40257-018-0370-9,Dupilumab: A Review in Moderate-to-Severe Atopic Dermatitis.
29971354,29971354,10.1001/jamadermatol.2018.1572,Association of Inadequately Controlled Disease and Disease Severity With Patient-Reported Disease Burden in Adults With Atopic Dermatitis.
29953999,29953999,10.1159/000490002,Inflammation: A Contributor to Depressive Comorbidity in Inflammatory Skin Disease.
29923228,29923228,10.1111/jdv.15145,The self-assessed psychological comorbidities of prurigo in European patients: a multicentre study in 13 countries.
29872673,29872673,10.1016/j.ijwd.2017.11.002,The impact of pediatric skin disease on self-esteem.
29869332,29869332,10.1111/ijd.14076,Psychosomatic factors of atopic dermatitis exacerbation.
29860041,29860041,10.1016/j.jaad.2018.05.039,Association of family structure with atopic dermatitis in US children.
29786146,29786146,10.1111/pde.13527,"Awareness of and phobias about topical corticosteroids in parents of infants with eczema in Hangzhou, China."
29766369,29766369,10.1007/s12016-018-8688-x,Nutritional Issues in Food Allergy.
29740354,29740354,10.3389/fpsyt.2018.00133,"Increased Risk of Psychiatric Disorders in Allergic Diseases: A Nationwide, Population-Based, Cohort Study."
29733939,29733939,10.1016/j.jaad.2018.04.047,Ethnic differences and comorbidities of 909 prurigo nodularis patients.
29567854,29567854,10.1136/bmjopen-2017-020825,Risk factors of asthma exacerbation based on asthma severity: a nationwide population-based observational study in South Korea.
29555350,29555350,10.1016/j.anai.2018.03.009,The multidimensional burden of atopic dermatitis: An update.
29513367,29513367,10.1111/cea.13127,The familial aggregation of atopic diseases and depression or anxiety in children.
29500830,29500830,10.1111/1346-8138.14277,Changes in salivary chromogranin A levels in adults with atopic dermatitis are correlated with changes in their condition.
29433634,29433634,10.1016/S0151-9638(18)30088-7,[Burden of atopic dermatitis in adults].
29388334,29388334,10.1111/1346-8138.14218,Burden of atopic dermatitis in Japanese adults: Analysis of data from the 2013 National Health and Wellness Survey.
29374516,29374516,10.1016/j.neubiorev.2018.01.009,The vicious cycle of itch and anxiety.
29331049,29331049,10.1111/cea.13091,Prenatal maternal psychosocial stress and offspring's asthma and allergic disease: A systematic review and meta-analysis.
29319277,29319277,10.23736/S0392-0488.17.05794-7,Atopic dermatitis treatment: what's new on the horizon?
29292940,29292940,NA,[Atopic eczema common at all ages].
29275785,29275785,10.1016/j.jpsychores.2017.11.009,Food allergy: Children's symptom levels are associated with mothers' psycho-socio-economic variables.
