record_id,pmid,doi,title
36749389,36749389,10.1007/s00403-023-02538-0,The role of insomnia in the vulnerability to depressive and anxiety symptoms in atopic dermatitis adult patients.
36745557,36745557,10.1093/bjd/ljac132,"Factors associated with depression, anxiety and severe mental illness among adults with atopic eczema or psoriasis: a systematic review and meta-analysis."
36745376,36745376,10.36849/JDD.7053,A Qualitative Study on Dupilumab's Impact on Atopic Dermatitis Among Adolescent and Adult Patients.
36711419,36711419,10.3389/fpubh.2022.1068043,The positive effect of mother-performed infant massage on infantile eczema and maternal mental state: A randomized controlled trial.
36708375,36708375,10.1007/s00403-023-02536-2,Longitudinal course of cognitive impairment in patients with atopic dermatitis.
36695942,36695942,10.1007/s10354-022-00999-y,Netherton syndrome in a Bulgarian patient : Presentation of a case and an update of therapeutic options.
36693357,36693357,10.4168/aair.2023.15.1.43,Quality of Life in Food Allergy: Validation of the Korean Version of the Food Allergy Quality of Life Questionnaire Parent Form (K-FAQLQ-PF) and Risk Factor Analysis.
36688701,36688701,10.2340/actadv.v103.4426,Itching in Atopic Dermatitis: Patient- and Physician-reported Outcomes in the German Atopic Dermatitis Registry TREATgermany.
36686155,36686155,10.3389/fvets.2022.1104152,Pharmacokinetics of cannabidiol following single oral and oral transmucosal administration in dogs.
36660532,36660532,10.7759/cureus.32639,A Molecular Basis Approach of Eczema and Its Link to Depression and Related Neuropsychiatric Outcomes: A Review.
36639925,36639925,10.1111/ijd.16557,The impact of climate change on atopic dermatitis and mental health comorbidities: a review of the literature and examination of intersectionality.
36630818,36630818,10.1016/j.jpsychores.2022.111142,Maternal affective and stress-related factors during pregnancy affect the occurrence of childhood allergic diseases: A Shanghai MCPC study.
36629476,36629476,10.2340/actadv.v102.1502,Suicide and Suicidality in Children and Adolescents with Chronic Skin Disorders: A Systematic Review.
36621921,36621921,10.2340/actadv.v103.2242,Psychological Stress in Parents of Children with Atopic Dermatitis: A Cross-sectional Study from the Korea National Health and Nutrition Examination Survey.
36601597,36601597,10.1097/JW9.0000000000000068,Cognitive behavior therapy as dermatological treatment: a narrative review.
36478424,36478424,10.5021/ad.21.239,Assessment of Disease Severity and Quality of Life in Patients with Atopic Dermatitis from South Korea.
36435828,36435828,10.1186/s40659-022-00402-5,Correction: Acupuncture attenuates comorbid anxiety- and depressive-like behaviors of atopic dermatitis through modulating neuroadaptation in the brain reward circuit in mice.
36400426,36400426,10.1111/pde.15183,Topical corticosteroid phobia in adolescents with eczema and caregivers of children and adolescents with eczema: A cross-sectional survey.
36396409,36396409,10.3122/jabfm.2022.220115R1,An Evidence-Based Review of Vitamin D for Common and High-Mortality Conditions.
36332836,36332836,10.1016/j.jaip.2022.10.032,"Patients' and Caregivers' Experiences With Atopic Dermatitis-Related Burden, Medical Care, and Treatments in 8 Countries."
36321512,36321512,10.1111/1346-8138.16615,"Prevalence, comorbidities, and treatment patterns of Japanese patients with alopecia areata: A descriptive study using Japan medical data center claims database."
36301748,36301748,10.1684/ejd.2022.4266,Clinical manifestations and comorbidities of pemphigus: a retrospective case-control study in southern Finland.
36292360,36292360,10.3390/healthcare10101913,Prospective Analysis of the Temporal Relationship between Psychological Distress and Atopic Dermatitis in Female Adults: A Preliminary Study.
36246829,36246829,10.12998/wjcc.v10.i28.10155,Successful management of a breastfeeding mother with severe eczema of the nipple beginning from puberty: A case report.
36203121,36203121,10.1007/s43440-022-00423-7,The potential action of SSRIs in the treatment of skin diseases including atopic dermatitis and slow-healing wounds.
36197589,36197589,10.1007/s13555-022-00819-6,Burden of Atopic Dermatitis in Adults and Adolescents: a Systematic Literature Review.
36193008,36193008,10.2340/actadv.v102.803,The Impact of Systemic Treatment of Atopic Dermatitis on Depressive Symptoms: A Prospective Clinical Cohort Study.
36152694,36152694,10.1016/j.jaad.2022.09.015,Alcohol use disorder among adults with atopic dermatitis: A case-control study in the All of Us research program.
36129669,36129669,10.1007/s13555-022-00814-x,Release of Cervical Muscle Tension Improves Psychological Stress and Symptoms of Moderate-to-Severe Atopic Dermatitis: a Case Series with 20 Patients.
36092257,36092257,10.1002/ski2.143,Long term effects of digital education among healthcare professionals in paediatric dermatology: Opportunities for improving care.
36057460,36057460,10.1016/j.abd.2021.11.007,A low level of health literacy is a predictor of corticophobia in atopic dermatitis.
36049473,36049473,10.1159/000525901,The COVID-19 Pandemic and Recent Earthquake in Zagreb Together Significantly Increased the Disease Severity of Patients with Atopic Dermatitis.
36035402,36035402,10.3389/fmed.2022.965133,Psychologic interventions in patients with the chronic dermatologic itch in atopic dermatitis and psoriasis: A step forward with family constellations seminars.
36030827,36030827,10.1016/j.ad.2022.08.015,"Real-World Treatment Patterns, Resource Use and Costs in Adult Patients With Atopic Dermatitis Receiving Systemic Treatment: Derma-Atopic Study in Spain."
36018560,36018560,10.1111/jdv.18564,Atopic dermatitis and risk of major neuropsychiatric disorders in children: A population-based cohort study.
35988076,35988076,10.12740/PP/127952,Evaluation of the relationship between some mental state parameters and the quality of life in patients with allergic diseases.
35951359,35951359,10.1097/DER.0000000000000921,Association of Adult Atopic Dermatitis Severity With Decreased Physical Activity: A Cross-sectional Study.
35948330,35948330,10.5021/ad.21.282,Impairment of Quality of Life and Mental Health Status in Adult-Onset Atopic Dermatitis.
35927911,35927911,10.2174/1570163819666220801121857,Hydrophobically Modified Abelmoschus esculentus Polysaccharide Based Nanoparticles and Applications: A Review.
35885851,35885851,10.3390/healthcare10071326,Relationship between Smartphone Addiction and Sleep Satisfaction: A Cross-Sectional Study on Korean Adolescents.
35857381,35857381,10.1111/jdv.18442,"Patient perspectives of atopic dermatitis: comparative analysis of terminology in social media and scientific literature, identified by a systematic literature review."
35816285,35816285,10.1111/ijd.16344,Psychopathological symptoms in dermatology: A basic approach toward psychocutaneous disorders.
35767748,35767748,10.26444/aaem/141324,Frontal Fibrosing Alopecia - a review and a practical guide for clinicians.
35756263,35756263,10.3389/fpsyg.2022.883019,Sexual Self-Esteem and Psychological Burden of Adults With Neurofibromatosis Type 1.
35717147,35717147,10.1186/s12887-022-03382-3,Study protocol: assessing SleeP IN infants with early-onset atopic Dermatitis by Longitudinal Evaluation (The SPINDLE study).
35699028,35699028,10.1080/03007995.2022.2088715,Characterizing real world safety profile of oral Janus kinase inhibitors among adult atopic dermatitis patients: evidence transporting from the rheumatoid arthritis population.
35645683,35645683,10.5114/ada.2021.103459,L. Cucurbita pepo modulates contact dermatitis in depressed rats through downregulation of proinflammatory cytokines and upregulation of antioxidant status.
35620027,35620027,10.1097/JW9.0000000000000002,Exacerbation and severity of allergic symptoms during pregnancy and their impact on mental health.
35563285,35563285,10.3390/ijms23094898,Annoying Psoriasis and Atopic Dermatitis: A Narrative Review.
35551964,35551964,10.1016/j.jaad.2022.04.061,Longitudinal course and predictors of depressive symptoms in atopic dermatitis.
35535633,35535633,10.1111/dth.15573,Facial dermatoses and use of protective mask during Covid-19 pandemic: A clinical and psychological evaluation in patients affected by moderate-severe atopic dermatitis under treatment with dupilumab.
35534297,35534297,10.1016/j.ad.2022.01.025,Patient-Reported Outcome Measures in Real-World Atopic Dermatitis Studies in Spain: A Systematic Review.
35533665,35533665,10.1159/000524225,HautTief Multidisciplinary Educational Program for Patients with Psoriasis or Atopic Dermatitis: A Randomized Controlled Study.
35485975,35485975,10.1111/ijd.16228,"Comorbid diseases of hidradenitis suppurativa: a 15-year population-based study in Olmsted County, Minnesota, USA."
35484583,35484583,10.1186/s12991-022-00389-z,"Anxiety, depression and associated factors among caretakers of children with atopic dermatitis."
35457288,35457288,10.3390/ijms23084470,Dendrobium nobile Lindley Administration Attenuates Atopic Dermatitis-like Lesions by Modulating Immune Cells.
35418942,35418942,10.3389/fendo.2022.838434,Current Insights Into the Role of Neuropeptide Y in Skin Physiology and Pathology.
35387041,35387041,10.3389/falgy.2021.688999,"Pruritus, Allergy and Autoimmunity: Paving the Way for an Integrated Understanding of Psychodermatological Diseases?"
35368752,35368752,10.1155/2022/1307173,"Seungmagalgeun-Tang, a Traditional Herbal Formula, Alleviates Skin Inflammation and Depression-Like Behavior in Atopic Dermatitis Mice under Sleep Deprivation Conditions."
35315120,35315120,10.1111/1346-8138.16366,Longitudinal prevalence of atopic dermatitis among freshmen at Hiroshima University between 2002 and 2019.
35285091,35285091,10.1111/exd.14563,"Impact of psychiatric comorbidities in psoriasis, hidradenitis suppurativa and atopic dermatitis: The importance of a psychodermatological approach."
35255542,35255542,10.4168/aair.2022.14.2.273,"Analysis of Quality of Life and Mental Health in Patients With Atopic Dermatitis, Asthma and Allergic Rhinitis Using a Nation-wide Database, KNHANES VII."
35247394,35247394,10.1016/j.jpeds.2022.02.052,Self-Reported Health Outcomes of Children and Youth with 10 Chronic Diseases.
35243405,35243405,10.1016/j.jdin.2021.12.008,Correlation between anxiety and depression risk and atopic dermatitis severity in Taiwan: A cross-sectional study.
35218275,35218275,10.1111/dth.15407,Impact on health-related quality of life and symptoms of anxiety and depression after 32 weeks of Dupilumab treatment for moderate-to-severe atopic dermatitis.
35181720,35181720,10.1038/s41598-022-06838-9,Identifying multimorbidity profiles associated with COVID-19 severity in chronic patients using network analysis in the PRECOVID Study.
35178722,35178722,10.1111/pde.14914,The pediatric dermatology psychosocial screen: Promoting psychosocial coping and early identification of mental illness in pediatric dermatology patients.
35162757,35162757,10.3390/ijerph19031734,Impact of the COVID-19 Pandemic on Atopic Dermatitis Patients.
35155673,35155673,10.1155/2022/4084121,Association of Atopic Dermatitis with Depression and Suicide: A Two-Sample Mendelian Randomization Study.
35153845,35153845,10.3389/fpsyt.2021.721875,Hydroxyzine Use in Preschool Children and Its Effect on Neurodevelopment: A Population-Based Longitudinal Study.
35153299,35153299,10.1016/j.ad.2021.08.013,Impact of COVID-19 Pandemic on Patients with Atopic Dermatitis.
35089897,35089897,10.1097/DER.0000000000000834,Salivary Cortisol Values and Personality Features of Atopic Dermatitis Patients: A Prospective Study.
35083742,35083742,10.1111/bjd.21032,Epidemiology of prurigo nodularis in England: a retrospective database analysis.
35064309,35064309,10.1007/s00431-021-04341-3,Review of the holistic management of pediatric atopic dermatitis.
35000520,35000520,10.1080/13548506.2021.1971727,Psychological assessment of atopic dermatitis in Asia: a systematic review.
34947965,34947965,10.3390/life11121434,"Atopic Dermatitis Severity, Patient Perception of the Disease, and Personality Characteristics: How Are They Related to Quality of Life?"
34947845,34947845,10.3390/life11121314,Sexual Dysfunction and Atopic Dermatitis: A Systematic Review.
34944580,34944580,10.3390/biomedicines9121764,Serum-Derived Neuronal Exosomal microRNAs as Stress-Related Biomarkers in an Atopic Dermatitis Model.
34936253,34936253,10.7705/biomedica.5978,"Clinical and sociodemographic features and quality of life in patients with atopic dermatitis who attended dermatology teaching clinics in Medellín, Antioquia and its metropolitan area."
34935621,34935621,10.1684/ejd.2021.4166,Symptom burden of patients with moderate-to-severe atopic dermatitis.
34864728,34864728,10.1159/000520159,"Depression, Anxiety, and Suicidal Ideation in Patients with Atopic Eczema in a Prospective Study in Leipzig, Germany."
34862805,34862805,10.1111/ced.15053,Gaining access to treatment; life at the far side of atopic eczema.
34828770,34828770,10.3390/children8111057,"Skin Disease in Children: Effects on Quality of Life, Stigmatization, Bullying, and Suicide Risk in Pediatric Acne, Atopic Dermatitis, and Psoriasis Patients."
34819201,34819201,10.1192/j.eurpsy.2021.2249,"A systematic review on shared biological mechanisms of depression and anxiety in comorbidity with psoriasis, atopic dermatitis, and hidradenitis suppurativa."
34815275,34815275,10.1136/bmjopen-2021-048782,Assessment of the quality of routine ambulatory healthcare for common disorders in children and adolescents in Germany: study protocol for a retrospective medical record review (QualiPäd).
34800600,34800600,10.1016/j.jaad.2021.11.014,Real-world comorbidities of atopic dermatitis in the US adult ambulatory population.
34797040,34797040,10.23822/EurAnnACI.1764-1489.237,Effects of elimination diets and clinical findings on mothers' anxiety in infants with food allergy with non-life-threatening reactions.
34787024,34787024,10.1080/07853890.2021.2004322,Dermatology for the internist: optimal diagnosis and management of atopic dermatitis.
34785540,34785540,10.1136/bmjopen-2020-045718,"Epidemiology, management and the associated burden of mental health illness, atopic and autoimmune conditions, and common infections in alopecia areata: protocol for an observational study series."
34779274,34779274,10.1177/00034894211058135,Increased Risk of Postpartum Depression in Women With Allergic Rhinitis During Pregnancy: A Population-Based Case-Control Study.
34779063,34779063,10.1111/jdv.17813,Patient-reported outcomes from the JADE COMPARE randomized phase 3 study of abrocitinib in adults with moderate-to-severe atopic dermatitis.
34779054,34779054,10.1111/jdv.17812,Atopic dermatitis and depressive symptoms. Results of the German national AD Registry TREATgermany.
34761667,34761667,10.23736/S2784-8671.21.07139-5,Atopic dermatitis in psychodermatology: a concise review for dermatologists.
34726312,34726312,10.1111/pai.13693,Family burden of hospital-managed pediatric atopic dermatitis: A nationwide registry-based study.
34704942,34704942,10.1684/ejd.2021.4135,Impact of the COVID-19 pandemic and lockdown on the clinical response to dupilumab treatment and the psychological status of non-infected atopic patients.
34691390,34691390,10.1002/clt2.12070,Prenatal PM2.5 affects atopic dermatitis depending on maternal anxiety and gender: COCOA study.
34683008,34683008,10.3390/healthcare9101328,"Sleep, Fatigue, and Depressive Symptoms among Female Nurses with Allergic Rhinitis."
34636512,34636512,10.36849/JDD.6328,The Psychosocial Burden Associated With and Effective Treatment Approach for Atopic Dermatitis: A Literature Review.
34633064,34633064,10.1111/ijd.15938,Sexual dysfunction in a cohort of patients with moderate-to-severe atopic dermatitis. Influence of dupilumab treatment.
34623642,34623642,10.1111/ced.14948,Longitudinal course and phenotypes of health-related quality of life in adults with atopic dermatitis.
34620525,34620525,10.1016/j.abd.2021.04.011,"More than a skin disease: stress, depression, anxiety levels, and serum neurotrophins in lichen simplex chronicus."
34611950,34611950,10.1111/cea.14010,Investigating the causal relationship between allergic disease and mental health.
34608623,34608623,10.1111/bjd.20783,Psychometric validation and responder definition of the sleep disturbance numerical rating scale in moderate-to-severe atopic dermatitis.
34585798,34585798,10.1111/jdv.17708,Addictions in patients with atopic dermatitis: a cross-sectional pilot study in Germany.
34582441,34582441,10.1371/journal.pmed.1003773,"Incidence, co-occurrence, and evolution of long-COVID features: A 6-month retrospective cohort study of 273,618 survivors of COVID-19."
34565802,34565802,10.1016/j.ad.2021.08.004,[Impact of COVID-19 Pandemic on Patients with Atopic Dermatitis].
34553429,34553429,10.1111/jdv.17704,Improvement in symptoms of anxiety and depression in patients with atopic dermatitis after treatment with baricitinib.
34547964,34547964,10.1080/09546634.2021.1970704,Exploring the burden of xerosis cutis and the impact of dermatological skin care from patient's perspective.
34546111,34546111,10.1089/photob.2021.0025,Influence of Narrow-Band Ultra Violet B Phototherapy on Homocysteine Status: A Prospective Study of Patients with Different Cutaneous Disorders.
34534378,34534378,10.1111/jdv.17663,Assessing the relationship between topical corticosteroid phobia and susceptibility to misinformation in patients with atopic dermatitis.
34518893,34518893,10.2340/00015555-3922,Factors Associated with Affective Symptoms and Quality of Life in Patients with Atopic Dermatitis.
34516440,34516440,10.1097/DER.0000000000000795,Impact and Associations of Atopic Dermatitis Out-of-Pocket Health Care Expenses in the United States.
34515100,34515100,10.1159/000518220,"Pruritus, Pain, and Depression Associated with the Most Common Skin Diseases: Data from the French Study ""Objectifs Peau""."
34508369,34508369,NA,Psychosocial burden of patients with atopic dermatitis at two tertiary referral centres in Malaysia.
34468686,34468686,10.1001/jamadermatol.2021.2657,Association of Atopic Dermatitis and Mental Health Outcomes Across Childhood: A Longitudinal Cohort Study.
34467746,34467746,10.7748/ns.2021.e11744,Assessing and managing mental health issues in people with chronic skin conditions.
34457107,34457107,10.1016/j.waojou.2021.100571,Atopic dermatitis in the COVID-19 era: Results from a web-based survey.
34410205,34410205,10.1080/17512433.2021.1970529,Comparing quality of life outcomes of JAK inhibitors and biological treatments for atopic dermatitis: a systematic review and network meta-analysis.
34405394,34405394,10.1111/bjd.20622,Addressing the causality of the association of atopic dermatitis with depression and anxiety using Mendelian randomization.
34403497,34403497,10.1111/ijd.15852,Alterations in mental health and quality of life in patients with skin disorders: a narrative review.
34338364,34338364,10.1111/pde.14657,TH2 sensitization in the skin-gut-brain axis: How early-life Th2-mediated inflammation may negatively perpetuate developmental and psychologic abnormalities.
34292518,34292518,10.1007/s12325-021-01845-0,"Alopecia Areata Treatment Patterns, Healthcare Resource Utilization, and Comorbidities in the US Population Using Insurance Claims."
34281740,34281740,10.1016/j.abd.2020.09.010,"Evaluation of depression, stress and quality of life indexes in patients with atopic dermatitis."
34272025,34272025,10.1016/j.clindermatol.2020.07.002,The other side of atopic dermatitis: An evaluation of psychosocial comorbidities.
34202315,34202315,10.3390/life11070617,Patient Reported Outcome Measure in Atopic Dermatitis Patients Treated with Dupilumab: 52-Weeks Results.
34158009,34158009,10.1186/s12884-021-03909-z,Are prenatal anxiety or depression symptoms associated with asthma or atopic diseases throughout the offspring's childhood? An updated systematic review and meta-analysis.
34148325,34148325,10.29262/ram.v68i1.843,[Clinical characteristics of a population with atopic dermatitis in a tertiary center].
34138775,34138775,10.1097/DER.0000000000000772,The Burden of Coronavirus Disease 2019 and Its Complications in Patients With Atopic Dermatitis-A Nested Case-Control Study.
34122503,34122503,10.3389/fgene.2021.640951,Explore the Underlying Mechanism Between Atopic Dermatitis and Major Depressive Disorder.
34026782,34026782,10.3389/fmed.2021.644760,Itch in Atopic Dermatitis - What Is New?
34009282,34009282,10.1001/jamadermatol.2021.1450,Internet-Delivered Cognitive Behavior Therapy for Atopic Dermatitis: A Randomized Clinical Trial.
34001075,34001075,10.1186/s12905-021-01345-x,A study of the association of cognitive abilities and emotional function with allergic disorders in young women.
33991704,33991704,10.1016/j.jaip.2021.04.064,Sleep Disturbance in School-Aged Children with Atopic Dermatitis: Prevalence and Severity in a Cross-Sectional Sample.
33962662,33962662,10.1186/s13643-021-01687-5,Illness perceptions of adults with eczematous skin diseases: a systematic mixed studies review.
33954933,33954933,10.1007/s40257-021-00604-9,Impact of Oral Abrocitinib Monotherapy on Patient-Reported Symptoms and Quality of Life in Adolescents and Adults with Moderate-to-Severe Atopic Dermatitis: A Pooled Analysis of Patient-Reported Outcomes.
33931896,33931896,10.1111/pde.14607,Association between atopic dermatitis and headaches throughout childhood and adolescence-A longitudinal birth cohort study.
33921772,33921772,10.3390/ijms22084228,Comparative Analysis of the Microbiome across the Gut-Skin Axis in Atopic Dermatitis.
33898704,33898704,10.1016/j.ijwd.2020.06.011,Assessment of prurigo of pregnancy in patients without atopic background.
33890299,33890299,10.1111/pde.14588,Predictors and age-dependent pattern of psychologic problems in childhood atopic dermatitis.
33849750,33849750,10.1016/j.jfma.2021.03.024,The impact of atopic dermatitis on health-related quality of life in Taiwan.
33846604,33846604,10.1038/s41577-021-00538-7,"Does the epithelial barrier hypothesis explain the increase in allergy, autoimmunity and other chronic conditions?"
33840782,33840782,10.1097/DER.0000000000000749,Atopic Dermatitis Is Associated With Multiple Behavioral Problems in US Children and Adolescents.
33835411,33835411,10.1007/s13555-021-00515-x,Lifelong Impact of Severe Atopic Dermatitis on Quality of Life: A Case Report.
33817779,33817779,10.1111/bjd.20092,"Relationship between atopic dermatitis, depression and anxiety: a two-sample Mendelian randomization study."
33817750,33817750,10.1007/s00403-021-02219-w,Secular trends of atopic dermatitis and its comorbidities in United States children between 1997 and 2018.
33815789,33815789,10.4081/mrm.2021.736,Early responders within seven days of dupilumab treatment for severe asthma evaluated by patient-reported outcome: a pilot study.
33801061,33801061,10.3390/jcm10061298,Quality of Life and Psychological Impact in Patients with Atopic Dermatitis.
33795561,33795561,10.1097/DER.0000000000000725,Patient-Reported Symptoms and Disease Impacts in Adults With Moderate-to-Severe Atopic Dermatitis: Results From a Phase 2b Study With Abrocitinib.
33689777,33689777,10.1016/j.jaad.2021.03.016,Real-world comorbidities of atopic dermatitis in the pediatric ambulatory population in the United States.
33677998,33677998,10.1089/wound.2020.1364,Classification of Distinct Endotypes in Human Skin Scarring: S.C.A.R.-A Novel Perspective on Dermal Fibrosis.
33675326,33675326,10.1097/DER.0000000000000731,Epidemiology and Burden of Sleep Disturbances in Atopic Dermatitis in US Adults.
33670337,33670337,10.3390/ijerph18041770,The Psychological and Physical Effects of Forests on Human Health: A Systematic Review of Systematic Reviews and Meta-Analyses.
33601738,33601738,10.1016/j.jad.2021.01.002,Association between skin disorders and depression in children and adolescents: A retrospective case-control study.
33600510,33600510,10.12788/jfp.0130,Atopic dermatitis: More than just a rash.
33593424,33593424,10.1186/s13256-020-02628-x,Scabies-induced lichen simplex chronicus misdiagnosed as psychogenic pruritus: a case report.
33582952,33582952,10.1007/s11096-021-01241-2,Reducing corticosteroid phobia in pharmacy staff and parents of children with atopic dermatitis.
33555555,33555555,10.1007/s12325-021-01630-z,Psychosocial Comorbidities and Health Status Among Adults with Moderate-to-Severe Atopic Dermatitis: A 2017 US National Health and Wellness Survey Analysis.
33520081,33520081,10.1016/j.waojou.2021.100510,Psychological impact of the COVID-19 pandemic on patients with allergic diseases.
33496957,33496957,10.1007/s13555-021-00488-x,Extent and Impact of Inadequate Disease Control in US Adults with a History of Moderate to Severe Atopic Dermatitis Following Introduction of New Treatments.
33484762,33484762,10.1016/j.jaad.2021.01.033,Validity and reliability of Patient-Reported Outcomes Measurement Information System Global Health scale in adults with atopic dermatitis.
33470880,33470880,10.18553/jmcp.2021.20389,Economic burden of peanut allergy in pediatric patients with evidence of reactions to peanuts in the United States.
33461356,33461356,10.1080/09546634.2020.1866741,Disease burden and treatment history among adults with atopic dermatitis receiving systemic therapy: baseline characteristics of participants on the EUROSTAD prospective observational study.
33454962,33454962,10.1111/bjd.19817,Association between hospital-diagnosed atopic dermatitis and psychiatric disorders and medication use in childhood.
33453551,33453551,10.1016/j.jpsychores.2020.110347,Suicidal risks with psoriasis and atopic dermatitis: Systematic review and meta-analysis.
